{"attestation_policy":{"allowed_algorithms":["Ed25519"],"distinct_logical_signers_required":true,"policy_version":"hsai.attestation-policy.v1","registered_attestors":3,"threshold":2},"candidate_identity_policy":{"author_identity_required":false,"content_digest_algorithm":"sha256","source_identity_required":true},"challenge_descriptor_digest":"0101010101010101010101010101010101010101010101010101010101010101","claim_id":"claim_7ovtndna5wokusa7wy23dcaphm4xtmur4zcycwtghose5x7lk7aq","created_at":"2026-07-10T10:00:00Z","deadline_policy":{"authoritative_time_source":"local-ledger-receipt-time","boundary":"INCLUSIVE","ingestion_grace_period_seconds":300,"no_solution_requires_completeness":true,"permitted_source_clock_skew_seconds":0,"required_source_finality_depth":1,"submission_deadline":"2026-07-10T12:00:00Z","unavailable_source_behavior":"REMAIN_UNRESOLVED"},"dispute_policy":{"allowed_reason_codes":["COUNTEREXAMPLE"],"authority_id":"local-demo-operator","counterexample_candidate_allowed":true,"unresolved_dispute_blocks_finality":true,"window_seconds":600},"eligible_submission_policy":{"accepted_source_namespaces":["local.demo"],"allow_fetch_after_deadline_if_observed_before":true,"allowed_artifact_media_types":["application/octet-stream"],"disclosure_constraints":[],"duplicate_semantics":"IGNORE_EXACT_DUPLICATE","max_artifact_bytes":1048576,"replacement_semantics":"IMMUTABLE_SOURCE_REVISION","withdrawn_submissions_count":false},"evidence_publication_policy":{"default_classification":"PUBLIC","disclosure_policy_digest":null,"hidden_artifact_commitment_required":true,"public_verification_required":true},"freeze_not_before":"2026-07-10T10:00:00Z","observation_policy":{"cursor_required":true,"pagination_completeness_required":true,"raw_response_digest_required":true,"source_adapter_id":"local-submission-ledger","source_adapter_version":"1.0.0"},"outcome_mapping":{"false_settlement_fraction":"0","true_settlement_fraction":"1"},"predicate":{"kind":"EXISTS_ELIGIBLE_VALIDATOR_PASS"},"question":"Did an eligible submission pass the pinned verifier before the deadline?","resolution_policy":{"false_requires_complete_observation":true,"false_requires_deadline_and_grace":true,"false_requires_terminal_candidates":true,"infrastructure_failure_maps_to_false":false,"policy_version":"hsai.existential-resolution.v1","true_requires_eligible_pass":true},"schema_version":"hsai.claim-spec.v1","verification_policy":{"argv":["/validator/check","/input/candidate"],"clock_policy":"INJECTED_LOGICAL_TIME","cpu_architecture":"aarch64","determinism_tier":"SEMANTIC_IDENTICAL","environment_allowlist":["LANG","TZ"],"environment_digest":"0303030303030303030303030303030303030303030303030303030303030303","filesystem_layout_version":"hsai.runner.fs.v1","locale":"C.UTF-8","network_allowlist":[],"network_policy":"DISABLED","os_runtime_versions":{"linux":"fixture-v1"},"output_normalization_version":"hsai.validator.normalize.v1","randomness_policy":"DETERMINISTIC_SEED","required_instruction_sets":[],"required_replay_count":2,"required_runner_quorum":2,"resource_limits":{"cpu_millis":10000,"disk_bytes":134217728,"file_descriptor_count":64,"memory_bytes":268435456,"output_bytes":1048576,"process_count":16,"wall_clock_millis":30000},"result_mapping":{"accepted_status":"PASS","inconclusive_status":"INCONCLUSIVE","rejected_status":"FAIL","unspecified_is_error":true},"retry_count":0,"seed_derivation_domain":"hsai.validator.seed.v1","timezone":"UTC","validator_artifact_digest":"0202020202020202020202020202020202020202020202020202020202020202","validator_interface_version":"hsai.validator.result.v1"}}